{
  "aclSemanticGate": "BLOCKED_PENDING_SEMANTIC_RECOMPOSITION",
  "blockers": [
    "OPAQUE_GRANTEE_AMBIGUOUS_OR_UNPROVEN:PUBLIC_SCHEMA|RELATION",
    "OPAQUE_GRANTEE_AMBIGUOUS_OR_UNPROVEN:PUBLIC_SCHEMA|SEQUENCE",
    "OPAQUE_GRANTEE_CATEGORY_BLOCKED:PUBLIC_SCHEMA|RELATION",
    "OPAQUE_GRANTEE_CATEGORY_BLOCKED:PUBLIC_SCHEMA|SEQUENCE",
    "OPAQUE_GRANTEE_GRANT_OPTION_UNREVIEWED:PUBLIC_SCHEMA|RELATION",
    "OPAQUE_GRANTEE_GRANT_OPTION_UNREVIEWED:PUBLIC_SCHEMA|SEQUENCE"
  ],
  "businessRowReads": "NONE",
  "classificationFingerprint": "dc99cb2438907083cebbabb83fc0a7e6fd22b75ccf9443db42a4f54cfcbdf51f",
  "classifications": [
    {
      "aclState": "EXPLICIT_DEFAULT_ACL",
      "categoryMatchCount": 0,
      "classificationProof": "NAMED_ROLE_WITHOUT_REVIEWED_RELATION",
      "defaultAclKey": "PUBLIC_SCHEMA|RELATION",
      "grantOption": true,
      "membershipClassification": "NONE",
      "modelVersion": "bankeban-default-acl-opaque-grantee-v1",
      "objectType": "RELATION",
      "principalCategory": "OTHER_NAMED_PRINCIPAL",
      "principalPosition": "GRANTEE",
      "privilege": "DELETE",
      "semanticResult": "BLOCKED"
    },
    {
      "aclState": "EXPLICIT_DEFAULT_ACL",
      "categoryMatchCount": 0,
      "classificationProof": "NAMED_ROLE_WITHOUT_REVIEWED_RELATION",
      "defaultAclKey": "PUBLIC_SCHEMA|RELATION",
      "grantOption": true,
      "membershipClassification": "NONE",
      "modelVersion": "bankeban-default-acl-opaque-grantee-v1",
      "objectType": "RELATION",
      "principalCategory": "OTHER_NAMED_PRINCIPAL",
      "principalPosition": "GRANTEE",
      "privilege": "INSERT",
      "semanticResult": "BLOCKED"
    },
    {
      "aclState": "EXPLICIT_DEFAULT_ACL",
      "categoryMatchCount": 0,
      "classificationProof": "NAMED_ROLE_WITHOUT_REVIEWED_RELATION",
      "defaultAclKey": "PUBLIC_SCHEMA|RELATION",
      "grantOption": true,
      "membershipClassification": "NONE",
      "modelVersion": "bankeban-default-acl-opaque-grantee-v1",
      "objectType": "RELATION",
      "principalCategory": "OTHER_NAMED_PRINCIPAL",
      "principalPosition": "GRANTEE",
      "privilege": "MAINTAIN",
      "semanticResult": "BLOCKED"
    },
    {
      "aclState": "EXPLICIT_DEFAULT_ACL",
      "categoryMatchCount": 0,
      "classificationProof": "NAMED_ROLE_WITHOUT_REVIEWED_RELATION",
      "defaultAclKey": "PUBLIC_SCHEMA|RELATION",
      "grantOption": true,
      "membershipClassification": "NONE",
      "modelVersion": "bankeban-default-acl-opaque-grantee-v1",
      "objectType": "RELATION",
      "principalCategory": "OTHER_NAMED_PRINCIPAL",
      "principalPosition": "GRANTEE",
      "privilege": "REFERENCES",
      "semanticResult": "BLOCKED"
    },
    {
      "aclState": "EXPLICIT_DEFAULT_ACL",
      "categoryMatchCount": 0,
      "classificationProof": "NAMED_ROLE_WITHOUT_REVIEWED_RELATION",
      "defaultAclKey": "PUBLIC_SCHEMA|RELATION",
      "grantOption": true,
      "membershipClassification": "NONE",
      "modelVersion": "bankeban-default-acl-opaque-grantee-v1",
      "objectType": "RELATION",
      "principalCategory": "OTHER_NAMED_PRINCIPAL",
      "principalPosition": "GRANTEE",
      "privilege": "SELECT",
      "semanticResult": "BLOCKED"
    },
    {
      "aclState": "EXPLICIT_DEFAULT_ACL",
      "categoryMatchCount": 0,
      "classificationProof": "NAMED_ROLE_WITHOUT_REVIEWED_RELATION",
      "defaultAclKey": "PUBLIC_SCHEMA|RELATION",
      "grantOption": true,
      "membershipClassification": "NONE",
      "modelVersion": "bankeban-default-acl-opaque-grantee-v1",
      "objectType": "RELATION",
      "principalCategory": "OTHER_NAMED_PRINCIPAL",
      "principalPosition": "GRANTEE",
      "privilege": "TRIGGER",
      "semanticResult": "BLOCKED"
    },
    {
      "aclState": "EXPLICIT_DEFAULT_ACL",
      "categoryMatchCount": 0,
      "classificationProof": "NAMED_ROLE_WITHOUT_REVIEWED_RELATION",
      "defaultAclKey": "PUBLIC_SCHEMA|RELATION",
      "grantOption": true,
      "membershipClassification": "NONE",
      "modelVersion": "bankeban-default-acl-opaque-grantee-v1",
      "objectType": "RELATION",
      "principalCategory": "OTHER_NAMED_PRINCIPAL",
      "principalPosition": "GRANTEE",
      "privilege": "TRUNCATE",
      "semanticResult": "BLOCKED"
    },
    {
      "aclState": "EXPLICIT_DEFAULT_ACL",
      "categoryMatchCount": 0,
      "classificationProof": "NAMED_ROLE_WITHOUT_REVIEWED_RELATION",
      "defaultAclKey": "PUBLIC_SCHEMA|RELATION",
      "grantOption": true,
      "membershipClassification": "NONE",
      "modelVersion": "bankeban-default-acl-opaque-grantee-v1",
      "objectType": "RELATION",
      "principalCategory": "OTHER_NAMED_PRINCIPAL",
      "principalPosition": "GRANTEE",
      "privilege": "UPDATE",
      "semanticResult": "BLOCKED"
    },
    {
      "aclState": "EXPLICIT_DEFAULT_ACL",
      "categoryMatchCount": 0,
      "classificationProof": "NAMED_ROLE_WITHOUT_REVIEWED_RELATION",
      "defaultAclKey": "PUBLIC_SCHEMA|SEQUENCE",
      "grantOption": true,
      "membershipClassification": "NONE",
      "modelVersion": "bankeban-default-acl-opaque-grantee-v1",
      "objectType": "SEQUENCE",
      "principalCategory": "OTHER_NAMED_PRINCIPAL",
      "principalPosition": "GRANTEE",
      "privilege": "SELECT",
      "semanticResult": "BLOCKED"
    },
    {
      "aclState": "EXPLICIT_DEFAULT_ACL",
      "categoryMatchCount": 0,
      "classificationProof": "NAMED_ROLE_WITHOUT_REVIEWED_RELATION",
      "defaultAclKey": "PUBLIC_SCHEMA|SEQUENCE",
      "grantOption": true,
      "membershipClassification": "NONE",
      "modelVersion": "bankeban-default-acl-opaque-grantee-v1",
      "objectType": "SEQUENCE",
      "principalCategory": "OTHER_NAMED_PRINCIPAL",
      "principalPosition": "GRANTEE",
      "privilege": "UPDATE",
      "semanticResult": "BLOCKED"
    },
    {
      "aclState": "EXPLICIT_DEFAULT_ACL",
      "categoryMatchCount": 0,
      "classificationProof": "NAMED_ROLE_WITHOUT_REVIEWED_RELATION",
      "defaultAclKey": "PUBLIC_SCHEMA|SEQUENCE",
      "grantOption": true,
      "membershipClassification": "NONE",
      "modelVersion": "bankeban-default-acl-opaque-grantee-v1",
      "objectType": "SEQUENCE",
      "principalCategory": "OTHER_NAMED_PRINCIPAL",
      "principalPosition": "GRANTEE",
      "privilege": "USAGE",
      "semanticResult": "BLOCKED"
    }
  ],
  "cleanupResult": "PASS",
  "connectionAttemptCount": 1,
  "finalStatus": "BLOCKED",
  "generatedAt": "2026-08-14T04:51:53.257Z",
  "identityResult": "PASS",
  "ledgerResult": {
    "differences": [],
    "expectedCount": 8,
    "observedCount": 8,
    "status": "PASS"
  },
  "modelVersion": "bankeban-default-acl-opaque-grantee-v1",
  "opaqueGranteeResult": "BLOCKED",
  "phase": "PRODUCTION_CLOSURE_PHASE_2J_OPAQUE_GRANTEE_SUPPLEMENT",
  "productionConnectionAttempted": true,
  "productionMutation": false,
  "rawOidPersisted": false,
  "rawPrincipalNamePersisted": false,
  "repositoryCommitSha": "4f5b1bd4c933d14735fd0823c577bfc513dc653c",
  "retryCount": 0,
  "roleBoundaryResult": "PASS",
  "schemaVersion": 1,
  "scope": "UNRESOLVED_PUBLIC_SCHEMA_RELATION_SEQUENCE_GRANTEE_ONLY",
  "sourcePhase2IEvidenceSha256": "bef26fa7e8c53ed68a841b9c8de7627b8542927396bcbb4d77a4b430c3285f7c",
  "sprintNumberingCappedAt": 65,
  "tlsVerification": "VERIFY_FULL_PASS",
  "transactionReadOnlyResult": "PASS"
}
